{
  "schema_version": "0.1",
  "project": {
    "name": "replace-me",
    "state": "greenfield",
    "default_branch": "main"
  },
  "execution": {
    "spec_dir": "__development/bombar/specs",
    "evidence_dir": "__development/bombar/evidence",
    "agent_adapter": ".bombar/adapters/generic.sh",
    "max_retries": 2,
    "heartbeat_seconds": 30,
    "auto_commit": true,
    "require_non_default_branch": true,
    "allow_live_actions_unattended": false,
    "gates": [
      "BOMBAR_CONFIGURE_A_REAL_GATE"
    ],
    "protected_paths": []
  },
  "approval": {
    "additional_artifacts": []
  }
}
